[
  {
    "id": "triage-001",
    "input": "Login fails on Chrome after the last deploy. Create a high-severity bug and assign it to the web team.",
    "tags": ["happy", "quick"],
    "case_type": "happy_path",
    "expected": {
      "must_call_tools": ["create_bug", "assign_owner"],
      "optional_tools": ["search_known_issues", "lookup_user"],
      "order_constraints": [["create_bug", "before", "assign_owner"]],
      "create_bug": { "severity_in": ["high", "critical", "p1", "p2"] }
    },
    "fixture": {
      "replay": true,
      "final_answer": "Created {{bug_id}} and assigned it to the web team.",
      "trajectory": [
        { "tool": "search_known_issues", "args": { "query": "login chrome deploy" } },
        {
          "tool": "create_bug",
          "args": {
            "title": "Login fails on Chrome post-deploy",
            "severity": "high",
            "description": "Users cannot log in on Chrome after the latest deploy."
          }
        },
        { "tool": "assign_owner", "args": { "bug_id": "$last_bug_id", "team": "web" } }
      ]
    }
  },
  {
    "id": "triage-002",
    "input": "Just list open high-severity bugs. Do not create anything.",
    "tags": ["list_only", "quick"],
    "case_type": "list_only",
    "expected": {
      "must_call_tools": ["list_open_bugs"],
      "must_not_call_tools": ["create_bug", "assign_owner"]
    },
    "fixture": {
      "replay": true,
      "final_answer": "Here are the open high-severity bugs from the tracker.",
      "trajectory": [
        { "tool": "list_open_bugs", "args": { "severity": "high" } }
      ]
    }
  },
  {
    "id": "triage-003",
    "input": "iOS push notifications are delayed. File a medium bug and assign to mobile.",
    "tags": ["happy", "quick"],
    "case_type": "happy_path",
    "expected": {
      "must_call_tools": ["create_bug", "assign_owner"],
      "optional_tools": ["search_known_issues"],
      "order_constraints": [["create_bug", "before", "assign_owner"]],
      "create_bug": { "severity_in": ["medium", "p3"] },
      "assign_owner": { "team_in": ["mobile"] }
    },
    "fixture": {
      "replay": true,
      "final_answer": "Logged {{bug_id}} as medium and assigned to mobile.",
      "trajectory": [
        { "tool": "search_known_issues", "args": { "query": "ios push notification delay" } },
        {
          "tool": "create_bug",
          "args": {
            "title": "iOS push notification delay",
            "severity": "medium",
            "description": "Push can lag several minutes on iOS 17."
          }
        },
        { "tool": "assign_owner", "args": { "bug_id": "$last_bug_id", "team": "mobile" } }
      ]
    }
  },
  {
    "id": "triage-004",
    "input": "Critical: payment API returns 500 on checkout. Create bug and assign backend.",
    "tags": ["happy", "quick"],
    "case_type": "happy_path",
    "expected": {
      "must_call_tools": ["create_bug", "assign_owner"],
      "optional_tools": ["search_known_issues"],
      "order_constraints": [["create_bug", "before", "assign_owner"]],
      "create_bug": { "severity_in": ["critical", "p1", "high"] }
    },
    "fixture": {
      "replay": true,
      "final_answer": "Created critical ticket {{bug_id}} and assigned to backend.",
      "trajectory": [
        {
          "tool": "create_bug",
          "args": {
            "title": "Payment API 500 on checkout",
            "severity": "critical",
            "description": "Checkout fails with 500 from payments service."
          }
        },
        { "tool": "assign_owner", "args": { "bug_id": "$last_bug_id", "team": "backend" } }
      ]
    }
  },
  {
    "id": "triage-005",
    "input": "Look up alice@example.com and tell me which team she is on. Do not create bugs.",
    "tags": ["lookup", "quick"],
    "case_type": "happy_path",
    "expected": {
      "must_call_tools": ["lookup_user"],
      "must_not_call_tools": ["create_bug", "assign_owner"],
      "answer_must_include": ["web"]
    },
    "fixture": {
      "replay": true,
      "final_answer": "alice@example.com is on the web team.",
      "trajectory": [
        { "tool": "lookup_user", "args": { "email": "alice@example.com" } }
      ]
    }
  },
  {
    "id": "triage-006",
    "input": "Search known issues for cart rounding problems. Do not file a ticket.",
    "tags": ["search", "quick"],
    "case_type": "happy_path",
    "expected": {
      "must_call_tools": ["search_known_issues"],
      "must_not_call_tools": ["create_bug", "assign_owner"]
    },
    "fixture": {
      "replay": true,
      "final_answer": "Found a known cart rounding issue in the knowledge base.",
      "trajectory": [
        { "tool": "search_known_issues", "args": { "query": "cart rounding" } }
      ]
    }
  },
  {
    "id": "triage-007",
    "input": "List all open bugs with no severity filter.",
    "tags": ["list_only"],
    "case_type": "list_only",
    "expected": {
      "must_call_tools": ["list_open_bugs"],
      "must_not_call_tools": ["create_bug"]
    },
    "fixture": {
      "replay": true,
      "final_answer": "Here is the full open-bug list.",
      "trajectory": [
        { "tool": "list_open_bugs", "args": {} }
      ]
    }
  },
  {
    "id": "triage-008",
    "input": "P1: analytics dashboard blank after release. Create and assign to platform.",
    "tags": ["happy"],
    "case_type": "happy_path",
    "expected": {
      "must_call_tools": ["create_bug", "assign_owner"],
      "optional_tools": ["search_known_issues"],
      "order_constraints": [["create_bug", "before", "assign_owner"]],
      "create_bug": { "severity_in": ["p1", "critical", "high"] }
    },
    "fixture": {
      "replay": true,
      "final_answer": "Opened {{bug_id}} (P1) for platform.",
      "trajectory": [
        {
          "tool": "create_bug",
          "args": {
            "title": "Analytics dashboard blank after release",
            "severity": "p1",
            "description": "Dashboard renders empty after latest release."
          }
        },
        { "tool": "assign_owner", "args": { "bug_id": "$last_bug_id", "team": "platform" } }
      ]
    }
  },
  {
    "id": "triage-009",
    "input": "Low severity: typo on settings page. Create bug and assign to web.",
    "tags": ["happy"],
    "case_type": "happy_path",
    "expected": {
      "must_call_tools": ["create_bug", "assign_owner"],
      "order_constraints": [["create_bug", "before", "assign_owner"]],
      "create_bug": { "severity_in": ["low", "p4"] }
    },
    "fixture": {
      "replay": true,
      "final_answer": "Created low-severity {{bug_id}} and assigned to web.",
      "trajectory": [
        {
          "tool": "create_bug",
          "args": {
            "title": "Typo on settings page",
            "severity": "low",
            "description": "Minor copy typo in account settings."
          }
        },
        { "tool": "assign_owner", "args": { "bug_id": "$last_bug_id", "team": "web" } }
      ]
    }
  },
  {
    "id": "triage-010",
    "input": "Create two bugs: (1) high severity flaky login on Safari, assign web; (2) medium severity slow search, assign backend.",
    "tags": ["multi_step", "quick"],
    "case_type": "multi_step",
    "expected": {
      "must_call_tools": ["create_bug", "assign_owner"],
      "optional_tools": ["search_known_issues"],
      "store": { "min_bugs": 2 }
    },
    "fixture": {
      "replay": true,
      "final_answer": "Created tickets {{bug_ids}} and assigned web and backend respectively.",

      "trajectory": [
        {
          "tool": "create_bug",
          "args": {
            "title": "Flaky login on Safari",
            "severity": "high",
            "description": "Intermittent login failures on Safari."
          }
        },
        { "tool": "assign_owner", "args": { "bug_id": "$last_bug_id", "team": "web" } },
        {
          "tool": "create_bug",
          "args": {
            "title": "Slow search results",
            "severity": "medium",
            "description": "Search takes >5s under load."
          }
        },
        { "tool": "assign_owner", "args": { "bug_id": "$last_bug_id", "team": "backend" } }
      ]
    }
  },
  {
    "id": "triage-011",
    "input": "Infra: VPN disconnects hourly. Create high bug and assign infra.",
    "tags": ["happy"],
    "case_type": "happy_path",
    "expected": {
      "must_call_tools": ["create_bug", "assign_owner"],
      "order_constraints": [["create_bug", "before", "assign_owner"]],
      "assign_owner": { "team_in": ["infra"] }
    },
    "fixture": {
      "replay": true,
      "final_answer": "Filed {{bug_id}} for infra regarding VPN disconnects.",
      "trajectory": [
        {
          "tool": "create_bug",
          "args": {
            "title": "VPN disconnects hourly",
            "severity": "high",
            "description": "Corporate VPN drops about once per hour."
          }
        },
        { "tool": "assign_owner", "args": { "bug_id": "$last_bug_id", "team": "infra" } }
      ]
    }
  },
  {
    "id": "triage-012",
    "input": "QA tooling: test report export CSV is truncated. Medium bug, assign qa.",
    "tags": ["happy"],
    "case_type": "happy_path",
    "expected": {
      "must_call_tools": ["create_bug", "assign_owner"],
      "order_constraints": [["create_bug", "before", "assign_owner"]],
      "assign_owner": { "team_in": ["qa"] }
    },
    "fixture": {
      "replay": true,
      "final_answer": "Created {{bug_id}} and assigned to qa.",
      "trajectory": [
        {
          "tool": "create_bug",
          "args": {
            "title": "Test report CSV export truncated",
            "severity": "medium",
            "description": "Exported CSV cuts off after 1000 rows."
          }
        },
        { "tool": "assign_owner", "args": { "bug_id": "$last_bug_id", "team": "qa" } }
      ]
    }
  },
  {
    "id": "triage-013",
    "input": "List only medium severity open bugs.",